{
  "client": "demo-brand",
  "platform": "cafe24",
  "version": "1.0.0",

  "contact": {
    "company": "데모브랜드",
    "person": "김OO",
    "role": "대표",
    "email": "contact@demo-brand.example",
    "phone": "010-0000-0000",
    "kakao_id": "demo-brand",
    "business_no": "000-00-00000"
  },

  "project": {
    "name": "쇼핑몰 리뉴얼",
    "start_date": "2026-06-01",
    "deadline": "2026-08-31",
    "status": "design",
    "budget": "300만원 (3주차 중간 정산 100만원 완료)",
    "notion_doc_url": "https://www.notion.so/example-demo-brand"
  },

  "platform_detail": {
    "mall_id": "demo-brand",
    "skin_code": "2",
    "editor_type": "H",
    "ftp_configured": true,
    "mobile_web_disabled": true
  },

  "brand": {
    "tone": "럭셔리 미니멀 — 절제된 톤, 여백 강조",
    "voice": "차분하고 정중함, 전문성 있는 권유체",
    "target": "30-50대 여성, 안티에이징·웰니스에 관심, 객단가 10-30만원대 수용",
    "keywords": ["슬로우에이징", "미니멀", "본질", "여백", "정성"],
    "do_say": ["본질에 집중한", "정성을 담아", "자연스러운", "오래 사용하는"],
    "dont_say": ["할인", "긴급", "마지막 기회", "후회 마세요", "X일 남음"]
  },

  "design_tokens": "./design-tokens.json",

  "pages": [
    {
      "type": "hero-main",
      "path": "/",
      "name": "메인",
      "status": "design",
      "figma_node": "42-15",
      "notes": "히어로 영상 1개 + 신상품 4개 + 브랜드 스토리 1개"
    },
    {
      "type": "plp-full",
      "path": "/product/list",
      "name": "전체 상품 목록",
      "status": "pending"
    },
    {
      "type": "pdp-full",
      "path": "/product/detail",
      "name": "상품 상세",
      "status": "pending"
    },
    {
      "type": "narrow",
      "path": "/about",
      "name": "브랜드 소개",
      "status": "pending"
    }
  ],

  "constraints": {
    "font": "Pretendard",
    "icon": "Phosphor",
    "css_prefix": "nk-",
    "no_italic": true,
    "breakpoints": ["375px", "768px", "1280px", "1440px"]
  },

  "social": {
    "instagram": "https://instagram.com/demo-brand",
    "naver_blog": "https://blog.naver.com/demo-brand",
    "homepage": "https://demo-brand.cafe24.com"
  },

  "history": [
    {
      "date": "2026-06-01",
      "action": "프로젝트 시작 · Tally 폼 수신",
      "by": "사용자"
    },
    {
      "date": "2026-06-03",
      "action": "Figma 시안 1차 검토 · 페이지 인벤토리 확정",
      "by": "figma-explorer + 사용자"
    },
    {
      "date": "2026-06-10",
      "action": "design-tokens.json v1.0.0 추출 · primary #2B2B2B 확정",
      "by": "figma-explorer"
    },
    {
      "date": "2026-06-21",
      "action": "메인 페이지 HTML 1차 완성 · qa-loop 0.85 합격",
      "by": "css-builder + qa-loop"
    }
  ],

  "notes": "클라이언트가 '깔끔하고 여백 많은' 톤을 강하게 선호. 화려한 배너·팝업·재고 임박 알림 등 모두 거부 의사 명시. 폰트 weight도 700 이하 권장."
}
